{
  "artifact": "cluster_model",
  "artifact_schema_version": "1.0",
  "candidate_destinations": [
    {
      "eligible": [
        "worker-01",
        "worker-02"
      ],
      "eligible_and_individually_fits": [
        "worker-01",
        "worker-02"
      ],
      "ineligible": [
        "worker-03"
      ],
      "pod": "shop/api-5c6b7d-aaaaa",
      "unknown": []
    },
    {
      "eligible": [
        "worker-01",
        "worker-02"
      ],
      "eligible_and_individually_fits": [
        "worker-01",
        "worker-02"
      ],
      "ineligible": [
        "worker-03"
      ],
      "pod": "shop/cart-0",
      "unknown": []
    },
    {
      "eligible": [
        "worker-01",
        "worker-02"
      ],
      "eligible_and_individually_fits": [
        "worker-01",
        "worker-02"
      ],
      "ineligible": [
        "worker-03"
      ],
      "pod": "shop/web-7d9f8c-aaaaa",
      "unknown": []
    },
    {
      "eligible": [
        "worker-01",
        "worker-02"
      ],
      "eligible_and_individually_fits": [
        "worker-01",
        "worker-02"
      ],
      "ineligible": [
        "worker-03"
      ],
      "pod": "shop/web-7d9f8c-bbbbb",
      "unknown": []
    }
  ],
  "data_completeness": {
    "capacity_assessment_complete": true,
    "nodes_inventory": "complete",
    "pod_disruption_budgets_inventory": "complete",
    "pods_inventory": "complete",
    "reasons": []
  },
  "diagnostics": [
    {
      "code": "PDB_ADVISORY_ONLY",
      "details": {
        "disruptions_allowed": 2,
        "matching_target_pods": [
          "shop/web-7d9f8c-aaaaa",
          "shop/web-7d9f8c-bbbbb"
        ]
      },
      "message": "advisory PDB assessment at snapshot time; does not establish drain safety",
      "severity": "info",
      "subject": "pdb/shop/web-pdb"
    }
  ],
  "drain_inventory": {
    "excluded": [
      {
        "drain_class": "DAEMONSET",
        "pod": "kube-system/node-exporter-worker-03",
        "replacement": "NOT_EXPECTED"
      }
    ],
    "kubectl_drain_flags_required": [
      "--ignore-daemonsets"
    ],
    "pdb_assessments": [
      {
        "advisory": true,
        "assessment": "PDB_ADVISORY_ONLY",
        "current_healthy": 3,
        "desired_healthy": 1,
        "disruptions_allowed": 2,
        "expected_pods": 3,
        "matching_target_pods": [
          "shop/web-7d9f8c-aaaaa",
          "shop/web-7d9f8c-bbbbb"
        ],
        "pdb": "shop/web-pdb",
        "selector": "app=web",
        "selector_uncertain": false,
        "unhealthy_pod_eviction_policy": null
      }
    ],
    "placement_candidates": [
      "shop/api-5c6b7d-aaaaa",
      "shop/cart-0",
      "shop/web-7d9f8c-aaaaa",
      "shop/web-7d9f8c-bbbbb"
    ],
    "pods": [
      {
        "controller": {
          "api_version": "apps/v1",
          "kind": "DaemonSet",
          "known": true,
          "name": "node-exporter"
        },
        "drain_class": "DAEMONSET",
        "findings": [
          {
            "code": "DAEMONSET_POD",
            "detail": "node-exporter"
          }
        ],
        "kubectl_drain_flags": [
          "--ignore-daemonsets"
        ],
        "matching_pdbs": [],
        "placement_candidate": false,
        "pod": "kube-system/node-exporter-worker-03",
        "replacement": "NOT_EXPECTED"
      },
      {
        "controller": {
          "api_version": "apps/v1",
          "kind": "ReplicaSet",
          "known": true,
          "name": "api-5c6b7d"
        },
        "drain_class": "CONTROLLER_MANAGED",
        "findings": [
          {
            "code": "REPLACEMENT_TEMPLATE_UNKNOWN",
            "detail": "replacement modeled from the current pod spec; controller template not in snapshot"
          }
        ],
        "kubectl_drain_flags": [],
        "matching_pdbs": [],
        "placement_candidate": true,
        "pod": "shop/api-5c6b7d-aaaaa",
        "replacement": "ASSUMED"
      },
      {
        "controller": {
          "api_version": "apps/v1",
          "kind": "StatefulSet",
          "known": true,
          "name": "cart"
        },
        "drain_class": "CONTROLLER_MANAGED",
        "findings": [
          {
            "code": "REPLACEMENT_TEMPLATE_UNKNOWN",
            "detail": "replacement modeled from the current pod spec; controller template not in snapshot"
          },
          {
            "code": "STATEFUL_IDENTITY",
            "detail": "replacement keeps the same identity and volume claims"
          }
        ],
        "kubectl_drain_flags": [],
        "matching_pdbs": [],
        "placement_candidate": true,
        "pod": "shop/cart-0",
        "replacement": "ASSUMED"
      },
      {
        "controller": {
          "api_version": "apps/v1",
          "kind": "ReplicaSet",
          "known": true,
          "name": "web-7d9f8c"
        },
        "drain_class": "CONTROLLER_MANAGED",
        "findings": [
          {
            "code": "REPLACEMENT_TEMPLATE_UNKNOWN",
            "detail": "replacement modeled from the current pod spec; controller template not in snapshot"
          }
        ],
        "kubectl_drain_flags": [],
        "matching_pdbs": [
          "shop/web-pdb"
        ],
        "placement_candidate": true,
        "pod": "shop/web-7d9f8c-aaaaa",
        "replacement": "ASSUMED"
      },
      {
        "controller": {
          "api_version": "apps/v1",
          "kind": "ReplicaSet",
          "known": true,
          "name": "web-7d9f8c"
        },
        "drain_class": "CONTROLLER_MANAGED",
        "findings": [
          {
            "code": "REPLACEMENT_TEMPLATE_UNKNOWN",
            "detail": "replacement modeled from the current pod spec; controller template not in snapshot"
          }
        ],
        "kubectl_drain_flags": [],
        "matching_pdbs": [
          "shop/web-pdb"
        ],
        "placement_candidate": true,
        "pod": "shop/web-7d9f8c-bbbbb",
        "replacement": "ASSUMED"
      }
    ],
    "target_node": "worker-03"
  },
  "eligibility": [
    {
      "blockers": [],
      "capacity_fit": {
        "fit": "FITS",
        "reasons": []
      },
      "node": "worker-01",
      "pod": "shop/api-5c6b7d-aaaaa",
      "soft": [],
      "state": "ELIGIBLE",
      "unknowns": []
    },
    {
      "blockers": [],
      "capacity_fit": {
        "fit": "FITS",
        "reasons": []
      },
      "node": "worker-02",
      "pod": "shop/api-5c6b7d-aaaaa",
      "soft": [],
      "state": "ELIGIBLE",
      "unknowns": []
    },
    {
      "blockers": [
        {
          "code": "DRAIN_TARGET",
          "detail": "worker-03"
        }
      ],
      "capacity_fit": {
        "fit": "FITS",
        "reasons": []
      },
      "node": "worker-03",
      "pod": "shop/api-5c6b7d-aaaaa",
      "soft": [],
      "state": "INELIGIBLE",
      "unknowns": []
    },
    {
      "blockers": [],
      "capacity_fit": {
        "fit": "FITS",
        "reasons": []
      },
      "node": "worker-01",
      "pod": "shop/cart-0",
      "soft": [],
      "state": "ELIGIBLE",
      "unknowns": []
    },
    {
      "blockers": [],
      "capacity_fit": {
        "fit": "FITS",
        "reasons": []
      },
      "node": "worker-02",
      "pod": "shop/cart-0",
      "soft": [],
      "state": "ELIGIBLE",
      "unknowns": []
    },
    {
      "blockers": [
        {
          "code": "DRAIN_TARGET",
          "detail": "worker-03"
        }
      ],
      "capacity_fit": {
        "fit": "FITS",
        "reasons": []
      },
      "node": "worker-03",
      "pod": "shop/cart-0",
      "soft": [],
      "state": "INELIGIBLE",
      "unknowns": []
    },
    {
      "blockers": [],
      "capacity_fit": {
        "fit": "FITS",
        "reasons": []
      },
      "node": "worker-01",
      "pod": "shop/web-7d9f8c-aaaaa",
      "soft": [],
      "state": "ELIGIBLE",
      "unknowns": []
    },
    {
      "blockers": [],
      "capacity_fit": {
        "fit": "FITS",
        "reasons": []
      },
      "node": "worker-02",
      "pod": "shop/web-7d9f8c-aaaaa",
      "soft": [],
      "state": "ELIGIBLE",
      "unknowns": []
    },
    {
      "blockers": [
        {
          "code": "DRAIN_TARGET",
          "detail": "worker-03"
        }
      ],
      "capacity_fit": {
        "fit": "FITS",
        "reasons": []
      },
      "node": "worker-03",
      "pod": "shop/web-7d9f8c-aaaaa",
      "soft": [],
      "state": "INELIGIBLE",
      "unknowns": []
    },
    {
      "blockers": [],
      "capacity_fit": {
        "fit": "FITS",
        "reasons": []
      },
      "node": "worker-01",
      "pod": "shop/web-7d9f8c-bbbbb",
      "soft": [],
      "state": "ELIGIBLE",
      "unknowns": []
    },
    {
      "blockers": [],
      "capacity_fit": {
        "fit": "FITS",
        "reasons": []
      },
      "node": "worker-02",
      "pod": "shop/web-7d9f8c-bbbbb",
      "soft": [],
      "state": "ELIGIBLE",
      "unknowns": []
    },
    {
      "blockers": [
        {
          "code": "DRAIN_TARGET",
          "detail": "worker-03"
        }
      ],
      "capacity_fit": {
        "fit": "FITS",
        "reasons": []
      },
      "node": "worker-03",
      "pod": "shop/web-7d9f8c-bbbbb",
      "soft": [],
      "state": "INELIGIBLE",
      "unknowns": []
    }
  ],
  "generator": {
    "milestone": "M1",
    "name": "qplace",
    "version": "0.1.0"
  },
  "nodes": [
    {
      "allocatable": {
        "cpu_millicores": 3900,
        "memory_bytes": 16106127360,
        "pods": 110
      },
      "annotations": {},
      "capacity": {
        "cpu_millicores": 4000,
        "memory_bytes": 17179869184,
        "pods": 110
      },
      "kubelet_version": "v1.34.1",
      "labels": {
        "kubernetes.io/arch": "amd64",
        "kubernetes.io/hostname": "worker-01",
        "kubernetes.io/os": "linux"
      },
      "name": "worker-01",
      "other_allocatable": {},
      "ready": "True",
      "taints": [],